{
  "KIND": "FILE_SPEC",
  "FILE": {
    "TRACE_ID": "mqtt/broker/session_manager",
    "LANG": "C",
    "ROLE": "会话容器模块：维护会话数组、动态扩容、按 session_id 检索/替换/删除会话",
    "DOC_REF": []
  },
  "HEADER": {
    "PATH": "../broker/session_manager.h",
    "DEPENDENCY": [
      "../broker/session.h"
    ],
    "DATA": [
      {
        "NAME": "mqtt_session_manager_t",
        "KIND": "TYPE",
        "VISIBILITY": "PUBLIC",
        "ROLE": "SessionManager 不透明句柄，封装会话集合及容量管理细节"
      }
    ],
    "INTERFACE": [
      {
        "SIGNATURE": "mqtt_session_manager_t* mqtt_session_manager_create(void)",
        "NAME": "mqtt_session_manager_create",
        "KIND": "FUNC",
        "FUNCTION_TYPE": "EVENT_HANDLER",
        "ROLE": "创建空会话管理器，初始 count/cap/sessions 均为零值",
        "VISIBILITY": "public"
      },
      {
        "SIGNATURE": "void mqtt_session_manager_destroy(mqtt_session_manager_t* m)",
        "NAME": "mqtt_session_manager_destroy",
        "KIND": "FUNC",
        "FUNCTION_TYPE": "EVENT_HANDLER",
        "ROLE": "销毁会话管理器并释放其持有的全部会话对象与数组内存",
        "VISIBILITY": "public"
      },
      {
        "SIGNATURE": "void mqtt_session_manager_add(mqtt_session_manager_t* m, mqtt_session_t* s)",
        "NAME": "mqtt_session_manager_add",
        "KIND": "FUNC",
        "FUNCTION_TYPE": "EVENT_HANDLER",
        "ROLE": "按 session_id 插入会话：已存在则替换，否则扩容后追加",
        "VISIBILITY": "public"
      },
      {
        "SIGNATURE": "void mqtt_session_manager_remove(mqtt_session_manager_t* m, int session_id)",
        "NAME": "mqtt_session_manager_remove",
        "KIND": "FUNC",
        "FUNCTION_TYPE": "EVENT_HANDLER",
        "ROLE": "按 session_id 删除会话并回收内存，使用末尾覆盖保持数组紧凑",
        "VISIBILITY": "public"
      },
      {
        "SIGNATURE": "mqtt_session_t* mqtt_session_manager_get(mqtt_session_manager_t* m, int session_id)",
        "NAME": "mqtt_session_manager_get",
        "KIND": "FUNC",
        "FUNCTION_TYPE": "EVENT_HANDLER",
        "ROLE": "按 session_id 线性查找并返回会话指针，未命中返回 NULL",
        "VISIBILITY": "public"
      }
    ]
  },
  "SOURCE": {
    "PATH": "../broker/session_manager.c",
    "DEPENDENCY": [
      "../broker/session_manager.h"
    ],
    "DATA": [
      {
        "NAME": "struct mqtt_session_manager",
        "KIND": "TYPE",
        "VISIBILITY": "PRIVATE",
        "ROLE": "会话管理器私有实现，持有会话指针数组、元素个数和当前容量"
      }
    ],
    "INTERFACE": [
      {
        "TRACE_ID": "mqtt/broker/session_manager/mqtt_session_manager_create",
        "SIGNATURE": "mqtt_session_manager_t* mqtt_session_manager_create(void)",
        "NAME": "mqtt_session_manager_create",
        "KIND": "FUNC",
        "ROLE": "分配并返回零初始化的会话管理器对象",
        "CONTRACT": {
          "PRECONDITION": [
            {
              "TEXT": "调用前对象指针应有效；并发访问需由上层同步控制"
            }
          ],
          "POSTCONDITION": [
            {
              "TEXT": "函数执行后维持模块内部状态一致性，并向调用方返回结果/副作用"
            }
          ],
          "IDEMPOTENT": false,
          "THREAD_SAFETY": "SINGLE_THREAD_ONLY"
        },
        "VISIBILITY": "public"
      },
      {
        "TRACE_ID": "mqtt/broker/session_manager/mqtt_session_manager_destroy",
        "SIGNATURE": "void mqtt_session_manager_destroy(mqtt_session_manager_t* m)",
        "NAME": "mqtt_session_manager_destroy",
        "KIND": "FUNC",
        "ROLE": "遍历销毁所有会话后释放数组和管理器对象",
        "CONTRACT": {
          "PRECONDITION": [
            {
              "TEXT": "调用前对象指针应有效；并发访问需由上层同步控制"
            }
          ],
          "POSTCONDITION": [
            {
              "TEXT": "函数执行后维持模块内部状态一致性，并向调用方返回结果/副作用"
            }
          ],
          "IDEMPOTENT": false,
          "THREAD_SAFETY": "SINGLE_THREAD_ONLY"
        },
        "VISIBILITY": "public"
      },
      {
        "TRACE_ID": "mqtt/broker/session_manager/mqtt_session_manager_add",
        "SIGNATURE": "void mqtt_session_manager_add(mqtt_session_manager_t* m, mqtt_session_t* s)",
        "NAME": "mqtt_session_manager_add",
        "KIND": "FUNC",
        "ROLE": "处理会话新增/替换逻辑，并在需要时扩容数组；扩容失败时销毁待加入会话",
        "CONTRACT": {
          "PRECONDITION": [
            {
              "TEXT": "调用前对象指针应有效；并发访问需由上层同步控制"
            }
          ],
          "POSTCONDITION": [
            {
              "TEXT": "函数执行后维持模块内部状态一致性，并向调用方返回结果/副作用"
            }
          ],
          "IDEMPOTENT": false,
          "THREAD_SAFETY": "SINGLE_THREAD_ONLY"
        },
        "VISIBILITY": "public"
      },
      {
        "TRACE_ID": "mqtt/broker/session_manager/mqtt_session_manager_remove",
        "SIGNATURE": "void mqtt_session_manager_remove(mqtt_session_manager_t* m, int session_id)",
        "NAME": "mqtt_session_manager_remove",
        "KIND": "FUNC",
        "ROLE": "定位并删除指定会话，采用末元素前移方式 O(1) 收缩有效区间",
        "CONTRACT": {
          "PRECONDITION": [
            {
              "TEXT": "调用前对象指针应有效；并发访问需由上层同步控制"
            }
          ],
          "POSTCONDITION": [
            {
              "TEXT": "函数执行后维持模块内部状态一致性，并向调用方返回结果/副作用"
            }
          ],
          "IDEMPOTENT": false,
          "THREAD_SAFETY": "SINGLE_THREAD_ONLY"
        },
        "VISIBILITY": "public"
      },
      {
        "TRACE_ID": "mqtt/broker/session_manager/mqtt_session_manager_get",
        "SIGNATURE": "mqtt_session_t* mqtt_session_manager_get(mqtt_session_manager_t* m, int session_id)",
        "NAME": "mqtt_session_manager_get",
        "KIND": "FUNC",
        "ROLE": "遍历会话数组并按 session_id 返回匹配会话",
        "CONTRACT": {
          "PRECONDITION": [
            {
              "TEXT": "调用前对象指针应有效；并发访问需由上层同步控制"
            }
          ],
          "POSTCONDITION": [
            {
              "TEXT": "函数执行后维持模块内部状态一致性，并向调用方返回结果/副作用"
            }
          ],
          "IDEMPOTENT": false,
          "THREAD_SAFETY": "SINGLE_THREAD_ONLY"
        },
        "VISIBILITY": "public"
      },
      {
        "TRACE_ID": "mqtt/broker/session_manager/ensure_cap",
        "SIGNATURE": "static void ensure_cap(mqtt_session_manager_t* m, size_t need)",
        "NAME": "ensure_cap",
        "KIND": "FUNC",
        "VISIBILITY": "private",
        "ROLE": "容量保障函数：按倍增策略扩容 sessions 数组以容纳目标数量",
        "CONTRACT": {
          "PRECONDITION": [
            {
              "TEXT": "调用前对象指针应有效；并发访问需由上层同步控制"
            }
          ],
          "POSTCONDITION": [
            {
              "TEXT": "函数执行后维持模块内部状态一致性，并向调用方返回结果/副作用"
            }
          ],
          "IDEMPOTENT": false,
          "THREAD_SAFETY": "SINGLE_THREAD_ONLY"
        }
      }
    ]
  }
}
